{"format":"tetiva.collection-snapshot","version":1,"generator":"Tetiva 1.2.0","locale":"ru","collection":{"id":"775555882500","name":"Petstore API — демо","description":"# Petstore\n\nДемо-коллекция: **все протоколы**.\n\n```bash\ncurl {{baseUrl}}/pets\n```","auth":{"type":"bearer","fields":{"prefix":"Bearer","token":"{{token}}"},"redacted":[]},"scripts":{"pre":"pm.environment.set(\"ts\", Date.now());","post":""},"grpcMetadata":[{"key":"x-client","value":"tetiva","enabled":true,"redacted":false},{"key":"x-api-version","value":"2026-09","enabled":true,"redacted":false}],"items":[{"kind":"folder","id":"ee941c7ba6e1","name":"Питомцы","description":"CRUD по питомцам.","auth":{"type":"oauth2","fields":{"addTo":"header","clientAuth":"basic","clientId":"{{clientId}}","clientSecret":"","grant":"client_credentials","headerPrefix":"Bearer","queryParam":"access_token","scope":"pets:read pets:write","tokenUrl":"https://auth.example.com/oauth/token"},"redacted":["clientSecret"]},"scripts":{"pre":"console.log(\"folder pre\");","post":""},"items":[{"kind":"folder","id":"f8ea9a2fe0d9","name":"Администрирование","description":"","auth":null,"scripts":null,"items":[{"kind":"request","id":"bb33366f89bb","name":"Delete pet","description":"","protocol":"http","http":{"method":"DELETE","url":"{{baseUrl}}/pets/{{petId}}","headers":[],"body":{"type":"none","raw":"","fields":[],"fileName":""}},"auth":{"type":"inherit","fields":{},"redacted":[]},"scripts":null,"examples":[]},{"kind":"request","id":"dbc873f7d62c","name":"Check pet exists","description":"","protocol":"http","http":{"method":"HEAD","url":"{{baseUrl}}/pets/{{petId}}","headers":[],"body":{"type":"none","raw":"","fields":[],"fileName":""}},"auth":{"type":"jwt","fields":{"addTo":"header","alg":"HS256","claims":{"admin":true,"aud":["petstore","admin"],"iat":1727222400,"iss":"https://auth.example.com","sub":"{{userId}}"},"expiresIn":"","header":{"kid":"key-2026","typ":"JWT"},"headerPrefix":"Bearer","queryParam":"token","secret":"{{jwtSecret}}","secretBase64":""},"redacted":["expiresIn","secretBase64"]},"scripts":null,"examples":[]}]},{"kind":"request","id":"fe0ccb9a017b","name":"Получить питомца","description":"Возвращает питомца по `id`.","protocol":"http","http":{"method":"GET","url":"{{baseUrl}}/pets/{{petId}}?expand=owner&api_key=<redacted>","headers":[{"key":"Accept","value":"application/json","enabled":true,"redacted":false},{"key":"Authorization","value":"Bearer {{token}}","enabled":true,"redacted":false},{"key":"X-Api-Key","value":"<redacted>","enabled":true,"redacted":true},{"key":"X-{{tenantHeader}}","value":"acme","enabled":true,"redacted":false},{"key":"X-Debug","value":"1","enabled":false,"redacted":false}],"body":{"type":"none","raw":"","fields":[],"fileName":""}},"auth":{"type":"inherit","fields":{},"redacted":[]},"scripts":null,"examples":[{"id":"e0ef67af1acb","name":"200 Успех","status":200,"statusText":"OK","headers":[{"key":"Content-Type","value":"application/json; charset=utf-8","enabled":true,"redacted":false}],"body":"{\n  \"id\": 42,\n  \"name\": \"Барсик\"\n}","contentType":"application/json"},{"id":"c799c4153b86","name":"404 Не найден","status":404,"statusText":"Not Found","headers":[],"body":"{\"error\":\"pet not found\"}","contentType":"application/json"}]},{"kind":"request","id":"44e20075438e","name":"Create pet","description":"","protocol":"http","http":{"method":"POST","url":"{{baseUrl}}/pets","headers":[{"key":"Content-Type","value":"application/json","enabled":true,"redacted":false}],"body":{"type":"json","raw":"{\n  \"name\": \"Барсик\",\n  \"ownerId\": \"{{userId}}\"\n}","fields":[],"fileName":""}},"auth":{"type":"bearer","fields":{"prefix":"Bearer","token":""},"redacted":["token"]},"scripts":{"pre":"pm.environment.set(\"requestId\", crypto.randomUUID());","post":""},"examples":[{"id":"2d722c86ba40","name":"201 Created","status":201,"statusText":"Created","headers":[{"key":"Location","value":"/pets/43","enabled":true,"redacted":false}],"body":"{\"id\":43}","contentType":"application/json"}]},{"kind":"request","id":"6b38b045995a","name":"Загрузить фото","description":"","protocol":"http","http":{"method":"POST","url":"{{baseUrl}}/pets/{{petId}}/photos","headers":[],"body":{"type":"form","raw":"","fields":[{"key":"title","value":"Отчёт","type":"text","enabled":true},{"key":"file","value":"report.pdf","type":"file","enabled":true},{"key":"draft","value":"true","type":"text","enabled":false}],"fileName":""}},"auth":{"type":"basic","fields":{"password":"","username":"{{user}}"},"redacted":["password"]},"scripts":null,"examples":[]},{"kind":"request","id":"71b9a853b0c0","name":"Search (urlencoded)","description":"","protocol":"http","http":{"method":"POST","url":"{{baseUrl}}/pets/search","headers":[{"key":"Content-Type","value":"application/x-www-form-urlencoded","enabled":true,"redacted":false}],"body":{"type":"form","raw":"","fields":[{"key":"q","value":"рыжий кот","type":"text","enabled":true},{"key":"limit","value":"20","type":"text","enabled":true}],"fileName":""}},"auth":{"type":"none","fields":{},"redacted":[]},"scripts":null,"examples":[]},{"kind":"request","id":"a839c9459768","name":"Replace avatar","description":"","protocol":"http","http":{"method":"PUT","url":"{{baseUrl}}/pets/{{petId}}/avatar","headers":[{"key":"Content-Type","value":"image/png","enabled":true,"redacted":false}],"body":{"type":"binary","raw":"","fields":[],"fileName":"avatar.png"}},"auth":{"type":"aws_sigv4","fields":{"accessKeyId":"{{awsKeyId}}","region":"eu-central-1","secretAccessKey":"","service":"execute-api","sessionToken":""},"redacted":["secretAccessKey"]},"scripts":null,"examples":[]},{"kind":"request","id":"426815712935","name":"Import XML","description":"","protocol":"http","http":{"method":"PATCH","url":"{{baseUrl}}/pets/import","headers":[],"body":{"type":"xml","raw":"<?xml version=\"1.0\"?><pets><pet id=\"42\">Барсик</pet></pets>","fields":[],"fileName":""}},"auth":{"type":"digest","fields":{"password":"","username":""},"redacted":["password","username"]},"scripts":null,"examples":[]},{"kind":"request","id":"63935ee42574","name":"Ping","description":"","protocol":"http","http":{"method":"OPTIONS","url":"{{baseUrl}}/ping","headers":[],"body":{"type":"raw","raw":"ping","fields":[],"fileName":""}},"auth":{"type":"api_key","fields":{"addTo":"header","key":"X-Api-Key","value":"{{apiKey}}"},"redacted":[]},"scripts":null,"examples":[]}]},{"kind":"folder","id":"6016b8bc6e8b","name":"Realtime","description":"","auth":null,"scripts":null,"items":[{"kind":"request","id":"c93549f0e8fa","name":"Чат питомника","description":"","protocol":"websocket","websocket":{"url":"{{wsUrl}}/events?room=general","headers":[{"key":"Origin","value":"https://app.example.com","enabled":true,"redacted":false}],"subprotocols":["events.v1","json"],"messages":[{"name":"Подписка","format":"json","data":"{\"type\":\"subscribe\"}"},{"name":"Привет","format":"text","data":"Привет, мир"},{"name":"Ping frame","format":"binary","data":"3q2+7w=="}]},"auth":{"type":"inherit","fields":{},"redacted":[]},"scripts":{"pre":"","post":"console.log(pm.response.text());"},"examples":[]}]},{"kind":"request","id":"96f16ae31a3c","name":"Pet by id (GraphQL)","description":"","protocol":"graphql","graphql":{"url":"{{baseUrl}}/graphql","headers":[{"key":"Authorization","value":"Bearer {{token}}","enabled":true,"redacted":false}],"query":"query Pet($id: ID!) {\n  pet(id: $id) { id name }\n}","variables":"{\n  \"id\": \"{{petId}}\"\n}","operationName":"Pet"},"auth":{"type":"inherit","fields":{},"redacted":[]},"scripts":null,"examples":[{"id":"f28cda1bf5b7","name":"200 OK","status":200,"statusText":"OK","headers":[],"body":"{\"data\":{\"pet\":{\"id\":\"42\"}}}","contentType":"application/json"}]},{"kind":"request","id":"2a3470222c2e","name":"GetPet (gRPC)","description":"","protocol":"grpc","grpc":{"target":"{{grpcHost}}","service":"petstore.v1.PetService","method":"GetPet","message":"{\n  \"id\": \"42\"\n}","metadata":[{"key":"authorization","value":"Bearer {{token}}","enabled":true,"redacted":false},{"key":"x-api-version","value":"2026-09","enabled":true,"redacted":false},{"key":"x-client","value":"tetiva","enabled":true,"redacted":false},{"key":"x-request-id","value":"{{requestId}}","enabled":true,"redacted":false}]},"auth":{"type":"inherit","fields":{},"redacted":[]},"scripts":null,"examples":[{"id":"3a8e7869f987","name":"OK","status":0,"statusText":"OK","headers":[{"key":"content-type","value":"application/grpc","enabled":true,"redacted":false}],"body":"{\"id\":\"42\"}","contentType":"application/json"},{"id":"16db657d34c7","name":"NOT_FOUND","status":5,"statusText":"NOT_FOUND","headers":[],"body":"pet 7 not found","contentType":"text/plain"}]}]},"environment":{"name":"prod","variables":[{"key":"baseUrl","value":"https://petstore.example.com/v1","secret":false},{"key":"grpcHost","value":"grpc.petstore.example.com:443","secret":false},{"key":"wsUrl","value":"wss://ws.petstore.example.com","secret":false},{"key":"petId","value":"42","secret":false},{"key":"userId","value":"u-1001","secret":false},{"key":"tenantHeader","value":"Tenant","secret":false},{"key":"user","value":"","secret":true},{"key":"clientId","value":"","secret":true},{"key":"token","value":"","secret":true},{"key":"apiKey","value":"","secret":true},{"key":"jwtSecret","value":"","secret":true},{"key":"awsKeyId","value":"","secret":true}]}}